姓名,title,信息,url,dept
胡克林,特聘教授,"个人简介：胡克林，博士，2021年毕业于重庆大学输配电装备及系统安全与新技术国家重点实验室（现输变电装备技术全国重点实验室），获得电气工程博士学位，现为贵州大学电气工程学院教师。博士期间获“博士研究生国家奖学金”，“重庆大学电气工程学院优秀博士学位论文奖”等荣誉。现主要研究方向为：先进电工与新能源材料、气体传感器、电气设备状态监测等。实验室具备静电纺丝机、等离子表面处理仪、磁控溅射仪、微电子打印机、管式炉等微纳功能材料制备平台，恒温恒湿气敏测试平台、电化学工作站、可编程高压数字源表、锂电池内阻测试仪、IV测试仪、拉曼光谱仪等表征测试平台，以及无线电能传输实验平台、光伏电池检测平台、锂离子电池仿真模拟平台和功能材料计算仿真平台。联系邮箱：klhu@gzu.edu.cn科研项目：中央高校基本业务费博士生项目，2019CDXYDQ0010，Pd掺杂SnO2纳米带阵列油浸式氢敏传感器机理研究，2019年5月-2020年5月，主持，已结题；贵州省科技计划项目子课题，黔科合支撑[2021]一般365，SF6电气设备故障专家诊断系统开发，2021年7月-2023年12月，主持，已结题；贵州大学一流学科建设引进人才（特岗）科研项目，贵大特岗合字（2021）45号，电气设备新型智能传感技术与应用，2021年9月-2024年9月，主持，在研；贵州省双碳与新能源技术创新发展研究院开放基金，DCRE-2023-02，面向数据中心的能源高效利用关键技术研究，2023年8月-2024年8月，主持，在研；国家自然科学基金委员会，面上项目，51877023，Bi2Te3基柔性热电材料的3D打印低成本可控制备与结构调控特性研究，2019年1月-2022年12月，参与，已结题；国家自然科学基金委员会，面上项目，52177016，多元合成酯绝缘油分子结构设计、制备及性能提升机理研究，2022年1月-2025年12月，参与，在研。科研论文（一作通讯）：2020-2021年：Hu K, Wang F, Liu H, et al. Enhanced hydrogen gas sensing properties of Pd-doped SnO2 nanofibres by Ar plasma treatment[J]. Ceramics International, 2020, 46(2): 1609-1614. （中科院1区，IF：5.2）Hu K, Wang F, Shen Z, et al. Ar plasma treatment on ZnO–SnO2 heterojunction nanofibers and its enhancement mechanism of hydrogen gas sensing[J]. Ceramics International, 2020, 46(13): 21439-21447. （中科院1区，IF：5.2）Hu K, Wang F, Shen Z, et al. Ternary heterojunctions synthesis and sensing mechanism of Pd/ZnO–SnO2 hollow nanofibers with enhanced H2 gas sensing properties[J]. Journal of Alloys and Compounds, 2021, 850: 156663. （中科院2区，IF：6.2，2022年ESI高被引论文）Hu K, Wang F, Yan Y, et al. One step from nanofiber to functional hybrid structure: Pd doped ZnO/SnO2 heterojunction nanofibers with hexagonal ZnO columns for enhanced low-temperature hydrogen gas sensing[J]. Ceramics International, 2021, 47(11): 15228-15236. （中科院1区，IF：5.2）Hu K, Wang F, Shen Z, et al. Enhancement methods of hydrogen sensing for one-dimensional nanomaterials: A review[J]. International Journal of Hydrogen Energy, 2021, 46(38): 20119-20138. （中科院2区，IF：7.2）2022年：Hu K, Zhao Q, Guo Y, et al. Dual mechanisms of Pd-doped In2O3/CeO2 nanofibers for hydrogen gas sensing[J]. ACS Applied Nano Materials, 2022, 5(5): 6232-6240.（中科院2区，IF：5.9）2023年：Hu K, Yang Y, Hu Y, et al. CuO surface doped In2O3/CeO2 nanofibers for ppb-ppm level carbon monoxide gas detection in low-temperature[J]. Sensors and Actuators B: Chemical, 2023, 376: 132984. （中科院1区，IF：9.2）He T, Liu H, Zhang J, et al. Ag-Doped MoSe2/ZnO Heterojunctions: A Highly Responsive Gas-Sensitive Material for Selective Detection of NO Based on DFT Study[J]. Nanomaterials, 2023, 13(18): 2510. （中科院3区，IF：5.3，何涛，2021级硕士）He T, Liu H, Zhang J, et al. DFT study on the adsorption and sensing properties of dissolved gases (H2, CO and CH4) in transformer oil on PdO-doped In2O3 (1 1 0) surfaces[J]. Chemical Physics Letters, 2023, 832: 140865. （中科院4区，何涛，2021级硕士）Hu K, Zhang J, He Y, et al. Hydrogenation effect on 2D ZnO single crystal/ZnO–SnO2 two phase ceramics and its enhanced mechanism in H2 gas sensing[J]. Ceramics International, 2023. （中科院1区，IF：5.2）2024年：Yang Y, Hu K, Zhang J, et al. Adsorption properties of noble-metal (Ag, Rh, or Au)-doped CeO2 (1 1 0) to CO: A DFT+ U study[J]. Computational Materials Science, 2024, 231: 112543. （中科院3区，IF：3.3，杨岳鹏，2021级硕士）Yang J, Yang D, Bao J, et al. An Efficient Framework Based on Semi-Supervised Learning for Transformer Fault Diagnosis[J]. IEEJ TRANSACTIONS ON ELECTRICAL AND ELECTRONIC ENGINEERING, 2024. DOI:10.1002/tee.23979. （中科院4区，杨镓荣，2022级硕士）包金山，杨定坤，张靖，等. 基于特征提取与INGO-SVM的变压器故障诊断方法[J]. 电力系统保护与控制，2024. （EI核心，包金山，2021级硕士）发明专利：胡克林，张靖，杨镓荣等，一种基于半监督自训练模型的变压器故障诊断方法及装置，发明专利，申请号或专利号：202310762227.9胡克林，张靖，张英等，基于北方苍鹰算法优化SVM的GIS设备PD类型判定方法及系统，发明专利，申请号或专利号：202310512378.9胡克林，张靖，张英等，采用改进海洋捕食者算法优化SVM的GIS设备PD类型判定方法，发明专利，申请号或专利号：202211260293.8Wang F, Kelin H U, Zijia S, et al. Method for preparation of plasma-treated nanofiber-based hydrogen gas sensing material: U.S. Patent Application 17/906,072[P]. 2023-4-13.（美国专利）",http://ee.gzu.edu.cn/2021/1104/c3595a161218/page.htm,电器工程及其自动化
张超,特聘教授,"张超，男，1995年8月生，四川广安人。贵州大学特岗教授，贵州大学电气工程学院电自系教师。近年来以第一作者或通信作者发表论文 11 篇，授权发明专利 3项，并担任IET Power Electronics、IEEE Open Journal of Power Electronics等国际知名期刊的审稿人。  主要研究方向多端柔性交直流配电网运行、可靠性评估和保护技术宽禁带半导体器件（SiC、GaN）及其装备应用电力电子变换器高效运行与控制技术教育经历2017/09–2022/06，湖南大学，电气与信息工程学院，电气工程，博士（硕博连读）2013/09–2017/06，贵州大学，电气工程学院，电气工程及其自动化，本科科研项目国家自然科学基金面上项目，基于GaN晶体管的高性能多电平变换器，2020-01至2023-12，在研，参与国家自然科学基金面上项目，基于Si IGBT和SiC MOSFET智能混合功率模块的研究，2020-01至2023-12，在研，参与中船七二二所合作项目，5000kW固态VLF发信机高速开关器件应用研究，2018-01至2019-04，结题，参与代表性学术成果Chao Zhang et al., ""WBG and Si Hybrid Half-Bridge Power Processing Toward Optimal Efficiency, Power Quality, and Cost Tradeoff,"" in IEEE Transactions on Power Electronics, vol. 37, no. 6, pp. 6844-6856, June 2022. (SCI收录，行业TOP期刊)Chao Zhang et al., ""A High-Frequency Dynamically Coordinated Hybrid Si/SiC Interleaved CCM Totem-Pole Bridgeless PFC Converter,"" in IEEE Journal of Emerging and Selected Topics in Power Electronics, vol. 10, no. 2, pp. 2088-2100, April 2022. (SCI收录）Chao Zhang et al., “A New PFC Design with Interleaved MHz-Frequency GaN Auxiliary Active Filter Phase and Low-Frequency Base Power Si Phase,” IEEE Journal of Emerging and Selected Topics in Power Electronics, vol. 8, no. 1, pp. 557–566, Mar. 2020. (SCI收录）Zongjian Li, Chao Zhang et al., “Dynamic Gate Delay Time Control of Si/SiC Hybrid Switch for Loss Minimization in Voltage Source Inverter” in IEEE Journal of Emerging and Selected Topics in Power Electronics,vol. 10, no. 4, pp. 4160-4170, Aug. 2022. (SCI收录，通讯）Chao Zhang et al., “Coordinated Two-Stage Operation and Control for Minimizing Energy Storage Capacitors in Cascaded Boost-Buck PFC Converters,” IEEE Access, vol. 8, pp. 191286–191297, 2020. （SCI收录）Chao Zhang et al., “WBG Partial Power Processing: A New PFC Design with Interleaved MHz-Frequency GaN and Low-Frequency Si Phases,” in 2019 IEEE ECCE, Sep. 2019, pp. 2702–2706. （EI收录，行业顶级会议）Chao Zhang, et al., A Hybrid Si/SiC CCM Interleaved Totem-Pole Bridgeless PFC Converter with Coupled-Inductor and Hybrid-Frequency Interleaving Operation, in 2021 IEEE PEAS, 2021, pp. 1-5. （EI收录）王俊，张超，一种新型级联交错图腾柱无桥PFC电路及其控制方法，发明专利，已授权，专利号：ZL202010579874.2.王俊，张超，一种基于宽禁带器件和硅基器件的并联三相逆变器控制方法、电路、系统和可读存储介质，发明专利，已授权，专利号：ZL20211017475.6.王俊，张超，一种双频交错混合半桥电路及其控制方法，发明专利，已授权，专利号：ZL202110201361.2.联系方式联系地址：贵州省贵阳市花溪区贵州大学西校区电气工程学院电子邮件：zhangc@gzu.edu.cn",http://ee.gzu.edu.cn/2022/0925/c3595a177563/page.htm,电器工程及其自动化
严儒井,特聘教授,"严儒井，男，黎族，贵州安顺人，特岗教授，硕士导师,贵州大学学科学术带头人培育对象。2022年6月于华北电力大学动力工程及工程热物理专业获得工学博士学位，现任贵州大学电力工程及其自动化系教师，从事教学与科研工作。主要研究方向综合能源系统的供需协调优化调度电力市场背景下储能的综合价值及激励机制分布式新能源多联产系统火电厂的灵活、低碳、高效改造教育经历2011年9月-2015年6月，东北电力大学，风能与动力工程，本科2015年9月-2018年6月，东北电力大学，动力工程及工程热物理，硕士；2018年9月-2022年6月，华北电力大学，动力工程及工程热物理，博士主持/参与项目1、贵州省支撑计划项目“面向煤电改造的新型电力系统多能源协调调度技术研究”，2024年04月-2027年03月，黔科合支撑[2024]一般018，在研，子课题负责人。2、贵州省双碳与新能源技术创新发展研究院开放基金项目“应对大规模风光接入含灵活性改造煤电新型电力系统的多级协同调度技术研究”， 2023年07月-2024-07月，DCRE-2023-08，在研，主持。3、贵州大学勘察设计研究院有限责任公司创新基金项目“多不确定性下综合能源系统的多环节协同规划研究” 2022年12月-2025年12月，贵大勘察[2022]-01，在研，主持。4、贵州大学自然科学专项（特岗）科研基金项目，低碳综合能源系统的互补特性及供需协调规划，2022年08月-2025年08月，在研，主持5、国家自然科学基金重大项目，多能源互补的分布式能源系统基础研究，2021年01月01日-2025年12月31日，52090064，在研，参与代表性学术论文[1] Rujing Yan, Mou Wu, Junqiu Fan, et al.,Process integration and thermodynamic analysis of a multi-generation system including solar-assisted biomass gasification and chemical looping ammonia generation. Energy conversation and management, 2024, 306: 118263. (中科院一区TOP).[2] Mou Wu, Rujing Yan*, Jing Zhang, et., An enhanced stochastic optimization for more flexibility on integrated energy system with flexible loads and a high penetration level of renewables, Renewable energy, 2024, 227:120502. (中科院一区TOP).[3] Mou Wu, Junqiu Fan, Rujing Yan*, et., Flexible Regulation and Synergy Analysis of Multiple Loads of Buildings in a Hybrid Renewable Integrated Energy System, Sustainability, 2024,16(7),2969. (中科院三区).[4] Yan Rujing, Wang Jiangjiang, Huo Shuojie, et al., Flexibility improvement and stochastic multi-scenario hybrid optimization for an integrated energy system with high-proportion renewable energy. Energy. 2023, 263:125779. (中科院一区TOP). [5]Yan Rujing, Wang Jiangjiang, Huo Shuojie, et al., Comparative study for four technologies on flexibility improvement and renewable energy accommodation of combined heat and power system [J]. Energy. 2023, 263, 126056. (中科院一区TOP).[6] Yan Rujing, Wang Jiangjiang, Wang Jiahao, et al. A two-stage stochastic-robust optimization for a hybrid renewable energy CCHP system considering multiple scenario-interval uncertainties [J]. Energy, 2022, 247:123498. (中科院一区TOP).[7] Yan Rujing, Lu Zherui, Wang Jiangjiang, et al. Stochastic multi-scenario optimization for a hybrid combined cooling, heating and power system considering multi-criteria [J]. Energy Conversion and Management, 2021, 233:113911. (中科院一区TOP).[8] Yan Rujing, Wang Jiangjiang, Lu Shuaikang, et al. Multi-objective two-stage adaptive robust planning method for an integrated energy system considering load uncertainty[J]. Energy and Buildings, 2021, 235:110741. (中科院二区TOP).[9] Yan Rujing, Wang Jiangjiang, Zhu Sitong, et al. Novel planning methodology for energy stations and networks in regional integrated energy systems[J]. Energy Conversion and Management, 2020, 205:112441. (中科院一区TOP).[10] Yan Rujing, Wang Jiangjiang, Cheng Youliang, et al. Thermodynamic analysis of fuel cell combined cooling heating and power system integrated with solar reforming of natural gas [J]. Solar Energy, 2020, 206:396-412. (中科院二区TOP).[11] Wang Jiangjiang, Yan Rujing, Wang Zhuang, et al. Thermal Performance Analysis of an Absorption Cooling System Based on Parabolic Trough Solar Collectors [J]. Energies, 2018, 11(10):11102679；[12] Lu Chunyan, Wang Jiangjiang, Yan Rujing. Multi-objective optimization of combined cooling, heating and power system considering the collaboration of thermal energy storage with load uncertainties [J]. Journal of Energy Storage, 2021, 40:102819；(中科院二区).[13] Wang Jiangjiang, Huo Shuojie, Yan Rujing, et al. Leveraging heat accumulation of district heating network to improve performances of integrated energy system under source-load uncertainties [J]. Energy, 2022, 252: 124002. (中科院一区TOP).荣誉与奖励中国电力企业联合会2023年度电力科技创新奖二等奖，排名5.联系方式联系地址：贵州省贵阳市花溪区贵州大学西校区电气工程学院电子邮件：rjyan@gzu.edu.cn",http://ee.gzu.edu.cn/2022/0921/c3595a177288/page.htm,电器工程及其自动化
王红蕾,教授,王红蕾：                      男，汉族，1959年生，中共党员，管理学博士，贵州省省管专家，贵州大学三级教授，工业工程及管理学科博士生导师；西部发展能力中心主任。现任贵州大学党委常委、副校长（正厅长级，分管常务工作）。学习工作经历：1982年毕业于贵州工学院电机系工业电气自动化专业；1991年赴法国马赛岗贝尔堡地中海理工学院模型与控制研究所进修，1993年回国返校工作；2008年1月获中国科学院管理科学与工程学科博士学位。主要学术任职：中国系统工程学会常务理事；中国优选法、统筹法及经济数学学会理事；贵州省系统工程学会理事长；贵州省自动化学会副理事长。主要研究方向：网络技术在控制系统中的应用、管理系统工程（优化与决策）。科研情况：近年来主持有国家级、省部级科研项目多项。（下面为部分项目） 科技部攻关项目《基于CAN/LIN网络的汽车电子组合开关的开发》（2009GJF20009）；贵州省工业攻关课题（黔科合GY字〔2011〕3022）；贵州省重点实验室建设项目（黔科合平台人才 [2016]5103）；中国南方电网有限责任公司重点科技项目《城市配电网柔性互联关键设备及技术的研究——总体方案研究》；（2016年）获奖情况：1998年获贵州省科技进步三等奖；2012年获贵州省科技进步二等奖。联系方式：gzdxhlwang@163.com,http://ee.gzu.edu.cn/2017/1010/c3597a23841/page.htm,自动化系
吴钦木,教授,"男，博士，教授，中共党员，博士生导师，硕士生导师，国家注册电气工程师（供配电），国家自然科学基金函评专家，获贵州省科技进步三等奖一项。主要研究方向有控制理论与应用、运动控制、电动汽车传动控制、电驱动系统效率优化和故障诊断、深度学习等。  学习工作经历：硕士毕业于贵州工业大学控制理论与控制工程专业；博士毕业于华中科技大学控制系控制理论与控制工程专业；曾就职于华为技术有限公司；现任贵州大学电气工程学院副院长。近期主持项目：  1、国家自然科学基金资助项目，网联化电动汽车电驱动系统协同效率优化研究（52267003）；2、国家自然科学基金资助项目，基于DCNN和图像识别的电动汽车用PMSM故障诊断技术研究（51867006）；3、国家自然科学基金资助项目，基于ELAD 和RNN 的电动车用电动机运行效率快速优化关键技术研究（51367006）；4、贵州省自然科学基金资助项目，基于投影动态理论的电动汽车用电动机效率优化关键技术研究（黔科合基础[2018] 1029号）；5、贵州省支撑计划资助项目，基于医院云平台的人工智能深度学习网络在医学骨科影像诊断系统的开发与应用研究（与贵州省骨科医院联合申报,2022）。近期论文：[1]. MING-HANG TAN , QIN-MU WU*, ZHI-QIN HE. Oscillator-Based Hybrid Gait Phase Estimation Method for Hip Assistive Exoskeleton.IEEE Access,vol.12, 117177-117188,2022.[2]. Li Zhiyuan, Wu Qinmu*, Yang Shengming, Chen Xiangping, Diagnosis of rotor demagnetization and eccentricity faults for IPMSM based on deep CNN and image recognition, Complex & Intelligent Systems, Vol. 8, No. 6:5469-5488, 2022.[3].  Qinmu Wu, Xiaoyan Li, Mei Zhang, Likun Pang, Jiahao Li. Fast parameter identification of permanent magnet synchronous motor for electric vehicles. CONTROL ENGINEERING AND APPLIED INFORMATICS, Vol.21, No.4, pp. 34-42, 2019.[4]. Qin-Mu Wu, Yu Zhan,Mei Zhang, Xiang-Ping Chen, and Wen-Ping Cao, Effi-ciency Optimization Control of an IPMSM Drive System for Electric Vehicles(EVs). International Journal of Control, Automation and Systems, 19(X), pp.1-18, 2021.[5].  Bohai Liu, Qinmu Wu*, Zhiyuan Li and Xiangping Chen. Research on Fault Diagnosis of IPMSM for Electric Vehicles Based on Multi-Level Feature Fusion SPP Network. Symmetry, vol. 13, 1844, pp.1-23, 2021.[6]. Likun Pang, Qinmu Wu*, Senquan Ma and Jiahao Li. Research on the Influence of Torque, Speed and Allowable Loss Deviation on the Optimized Current in the Efficiency Optimization Control of IPMSM. IOP Conf. Series: Materials Science and Engineering, 2019.[7]. Qinmu Wu, Xiaoyan Li, Loss-minimizing control based on QP sequence of the IPMSM drive systems for electric vehicles,2017 29th Chinese Control And Decision Conference (CCDC),2017, page:797- 801. [8]. Qinmu Wu, Linjie An, and Min Cao. Optimization Current Computation of IPMSM Drive System for Electric Vehicles Based on the Projected Dynamic System, 2016 12th World Congress on Intelligent Control and Automation (WCICA), June 12-15, 2016, Guilin, China,page:3341-3345. [9]. Qinmu Wu, Xiangping Chen,Min Cao,Wenli Zhang, A study on a method solving optimal currents of IPMSM based on the PDS for electric vehicles2016 IEEE International Conference on Mechatronics and Automation, 2016, Haerbin, china, 2016.08.08-08.11,Pages: 2366-2370. [10].吴钦木，安林杰，李叶松，曹敏. 电动汽车用IPMSM损耗最小化电流求解方法，华中科技大学学报（自然科学版），第44卷，第6期，2016. [11].吴钦木，宗仁均，王林林，陈湘萍，罗雪梅.基于QP序列的IPMSM驱动系统优化电流求解法研究，四川大学学报（自然科学版），第53卷，第4期，2016, page: 770-774[12].吴钦木，王婷婷，黎小燕，基于Mann迭代的电动车用IPMSM效率优化控制，微电机，第51卷，第３期，page:11-17。[13].XIANG-PING CHEN, YAO-DONG WANG, AND QIN-MU WU*. A Bio-Fuel Power Generation System With Hybrid Energy Storage Undera Dynamic Programming Operation Strategy. IEEE Access. Vol.7, pp.64966-64977, 2019.[14]. Xiaoliu Yang，Zetao Li，Qingfang Zhang，Qinmu Wu, and Linli Yang. A Nonlinear Adaptive Observer-Based Differential Evolution Algorithm to Multiparameter Fault Diagnosis. Mathematical Problems in Engineering, Vol.2020, pp.1-12, 2020.[15].Mei Zhang, Qin-mu Wu, Xiang-ping Chen, Boutaïeb Dahhou and Ze-tao Li. Observer Design for Nonlinear Invertible System from the View of Both Local and Global Levels. applied science, Vol.10, 7966, pp.1-23, 2020.[16]. Ai-ping Pang, Zhen He, Ming-han Zhao, Guang-xiong Wang, Qin-mu Wu, and Ze-tao Li. Sum of Squares Approach for Nonlinear H∞ Control. Complesity, Vol.2018,pp.1-7, 2018.[17]. Mei ZHANG，Ze-tao LI，Qin-mu WU，Boutaïeb DAHHOU. Fault Diag-nosis for actuators of an intensified multifunctional Heat-Exchanger from the view of both Plant&Component levels. Iden- tification and Control, Vol. 36, No. 1, 2020.    联系方式：wqm_watlei@163.com",http://ee.gzu.edu.cn/2017/0914/c3597a23772/page.htm,自动化系
杨靖,教授,杨靖：                                                                                                         男，1973年生，教授，硕士生导师，博士，贵州省优秀青年人才，贵州大学学术骨干。 现主要从事自动化技术及其应用、物联网技术及其应用、信息技术、控制理论及其应用的科研与教学工作。   科研论文情况： 科研（主持国家级项目1项，省部级项目3项，地厅级项目2项），下面是主持的部分项目情况： 1、复杂山地环境中大规模异构传感器数据收集协议研究，国家自然科学基金； 2、蓝莓产品追踪溯源关键技术研究与应用，贵州省工业攻关项目； 3、基于传感器网络和RFID的智能化运输系统的研发及关键技术研究，贵州省优秀人才培养项目； 4、智能无线传感器网络中路由算法的优化研究，贵州省科技基金； 论文： 以第一作者或通信作者身份在国内外核心期刊及重要学术会议上发表学术论文30余篇，其中SCI/EI检索10篇，中文核心10篇。 知识产权等： 作为第一发明人获得实用新型专利8项，软件著作权登记3项，2项发明专利进入实审阶段，带领的科研团队现获得专利15项，投入使用3项。 作为主要人员参与企业开发省级新产品3项，贵州省经信委鉴定为新产品。 作为主要人员获得贵阳市优秀新产品贰等奖1次，壹等奖1次。   联系方式：332874271@qq.com  jyang7@gzu.edu.cn,http://ee.gzu.edu.cn/2017/0914/c3597a23773/page.htm,自动化系
李捍东,教授,李捍东，教授，硕士研究生导师。目前主要从事计算机控制、嵌入式系统、能源管理等方面教学与科研工作。    主持与参与了10余项横纵向科研项目，主编出版教材一部，发表了10余篇学术论文，获得授权实用新型专利和软件著作权数件。,http://ee.gzu.edu.cn/2017/0914/c3597a23836/page.htm,自动化系
何志琴,教授,何志琴 教授，研究生导师，长期从事自动化专业教学科研工作，研究方向为现代电力变换技术及电机驱动控制技术研究，目前承担省科技支撑项目《一款双下肢外骨骼机器人辅助装置设计》，多次指导学生在全国大学生智能车全国总决赛中荣获二等奖，西部赛区一等奖等荣誉称号。,http://ee.gzu.edu.cn/2017/0914/c3597a23834/page.htm,自动化系
