姓名,title,信息,url,dept
张靖,教授,"张靖，三级教授，博士生导师，博士，贵州省高等学校新型电力系统及其数字化技术工程研究中心主任，贵州省电力系统智能化技术重点实验室副主任，贵州省双碳与新能源技术创新发展研究院行政副院长，贵州省智能配电网及新能源利用关键技术研究科技创新人才团队领衔人，贵州省高层次创新型人才（百层次），贵州省优秀青年科技人才荣誉奖励：2024年，贵州省科学技术进步奖二等奖（排名第一）2023年，中电联电力创新奖二等奖（排名第二）2023年，贵州省科学技术进步奖二等奖（排名第一）2022年，贵州省高层次创新型人才（百层次）2018年，贵州大学国华奖2018年，宝钢优秀教师奖2017年，贵州省科学技术进步奖三等奖（排名第一）2014年，教育部霍英东基金青年教师奖2014年，贵州省青年科技奖2013年，中国南方电网有限责任公司技改贡献奖三等奖2013年，贵州电网公司技改贡献奖一等奖2012年，贵州电网公司科技进步二等奖2012年，贵州电网公司科技进步三等奖2011年，贵州大学“学术骨干”称号2010年，“贵阳市第十次自然科学优秀学术论文”一等奖2010年，“第三届贵州省自然科学优秀学术论文”三等奖2009年，入选贵州省优秀青年科技人才承担的主要纵向科研项目：“互联微电网多主体协同作用机理及能量管理优化方法研究”，国家自然科学基金 “高比例新能源和高比例电力电子装备电力系统稳定运行技术研究”，贵州省科技支撑项目“贵州省高层次创新型人才培养计划-百层次人才”，贵州省科技计划项目“电力体制改革和能源互联环境下源、网、荷多主体博弈研究”，贵州省科学技术基金“互联电力系统电压稳定非线性模型预测协调控制研究”，国家自然科学基金“励磁系统参数灵敏度分析及建模研究”，贵州省优秀青年科技人才培养对象专项基金“电力系统电压稳定非线性结构特征研究与应用”，贵州省科学技术基金“基于微分同胚正规形的电压稳定性研究”，贵州大学引进人才科研项目“电力系统电压稳定非线性结构特征分析”，贵州省留学人员科技项目“智能电网关键技术研究与应用”，贵州省工业攻关项目承担的主要横向项目：北盘江流域电网网架结构适应性贵州省“十四五”配电自动化规划贵州省增量配电业务改革试点建设研究 基于市场化机制和“三公”调度的区域安全约束AGC控制技术研究与应用贵州电网设备利用率研究贵州电网“十二五”期间无功优化配置研究“十二五”期间贵州电网供需形势及薄弱环节分析研究基于节能降耗与电压控制的地区电网无功优化研究发电机励磁系统模型参数计算研究学术论文：R. Yan, M. Wu, J. Fan, C. Sun, J. Wang, Y. He, H. Liu, P. Li, J. Zhang. Process integration and thermodynamic analysis of a multi-generation system including solar-assisted biomass gasification and chemical looping ammonia generation [J]. Energy Conversion and Management. 2024 ,306: 118263.He Y, Li Z, Zhang J, Shi G, Cao W. Day-ahead and intraday multi-time scale microgrid scheduling based on light robustness and MPC [J]. International Journal of Electrical Power & Energy Systems. 2023, 144: 108546.M. -M. Cheng, J. Zhang, D. -G. Wang, W. Tan and J. Yang, ""A Localization Algorithm Based on Improved Water Flow Optimizer and Max-Similarity Path for 3-D Heterogeneous Wireless Sensor Networks,"" in IEEE Sensors Journal, vol. 23, no. 12, pp. 13774-13788, 15 June15, 2023, doi: 10.1109/JSEN.2023.3271820.罗文健,张靖,何宇等.基于优势柔性策略-评价算法和迁移学习的区域综合能源系统优化调度[J].电网技术,2023,47(04):1601-1615.DOI:10.13335/j.1000-3673.pst.2022.1241Xianglun Nie, Jing Zhang, Yu He, Wenjian Luo, Tingyun Gu, Bowen Li, and Xiangxie Hu. Ground Fault Detection Based on Fault Data Stitching and Image Generation of Resonant Grounding Distribution Systems. Energies.2023;16(7):2937.Geng, Guanchen, Yu He, Jing Zhang, Tingxiang Qin, and Bin Yang. Short-Term Power Load Forecasting Based on PSO-Optimized VMD-TCN-Attention Mechanism, Energies, 2023, 16(12): 4616.Zhang J, Long B, He Y, et al. Grouping consistency control strategy based on DMPC and energy storage unit constraints[J]. International Journal of Electrical Power & Energy Systems, 2023, 148: 108958.Jing Zhang, Dezheng Kong, Yu He, Xiaofan Fu, Xiangyu Zhao, Gang Yao, Fei Teng, Yuan Qin, Bi-layer energy optimal scheduling of regional integrated energy system considering variable correlations, International Journal of Electrical Power & Energy Systems, 2023, Volume 148, 108840龙本锦,张靖,何宇,秦廷翔,杨薛亮,龙道银.基于DMPC和储能单元约束的分组一致性控制策略[J].电力系统保护与控制,2022,50(24):23-36.Gan W, Yan M, Wen J, Jing Zhang, et al. A low-carbon planning method for joint regional-district multi-energy systems: From the perspective of privacy protection[J]. Applied Energy, 2022, 311: 118595.Rujing Yan, Jiangjiang Wang, Shuojie Huo, Yanbo Qin, Jing Zhang, Saiqiu Tang, Yuwei Wang, Yan Liu, Lin Zhou, Flexibility improvement and stochastic multi-scenario hybrid optimization for an integrated energy system with high-proportion renewable energy, Energy, 2022, 125779王志杨,张靖,何宇,古庭赟,李博文.数据与模型混合驱动的区域综合能源系统双层优化调度决策方法[J].电网技术,2022,46(10):3797-3813.Jing Zhang, Yikun Zhang, X. Xu, X. Fu and Y. He, Unsupervised and Supervised Learning Combined Power Load Curve Classification Based on Sequential Trajectory Feature Extraction Algorithm[J]. IEEE Access, 2022, 10: 90312-90320.Huang, S., Zhang, J., He, Y., Fu, X., Fan, L., Yao, G., Wen, Y.. Short-Term Load Forecasting Based on the CEEMDAN-Sample Entropy-BPNN-Transformer[J]. Energies, 2022, 15(10): 3659.Huang, Y.; Zhang, J.; Wei, W.; Qin, T.; Fan, Y.; Luo, X.; Yang, J. Research on Coverage Optimization in a WSN Based on an Improved COOT Bird Algorithm. Sensors 2022, 22, 3383.Liu, W.; Zhang, J.; Wei, W.; Qin, T.; Fan, Y.; Long, F.; Yang, J. A Hybrid Bald Eagle Search Algorithm for Time Difference of Arrival Localization. Appl. Sci. 2022, 12, 5221. 孔德政,张靖,何宇,滕飞,秦袁,王浩.区域综合能源系统IGDT-MPC双层能量优化调度[J].电网技术,2022,46(10):3970-3979.郭永强,张靖,何宇等.考虑电动汽车充放电响应的微电网混合储能配置[J].电网与清洁能源,2022,38(08):82-93.魏科文,张靖,何宇,刘影,姚刚,张义坤.基于VMD和相关性聚类的谐振接地系统单相接地故障选线[J].电力系统保护与控制,2021,49(22):105-113.陈朝宽,张靖,何宇,方裕,曾希皙,梁龙基.基于Cornish-Fisher级数和半不变量法的含光伏配电系统风险评估[J].电力自动化设备,2021,41(02):91-96.姚刚,熊国江,张靖,石珂,伍仕红.区域风光集群断面裕度分配策略研究[J].电力系统保护与控制,2021,49(19):48-55.J. Zhang, Dian Qin, Yongchun Ye, Yu He, Xiaofan Fu, Jing Yang, Guoyi Shi, Heng Zhang. Multi-time scale economic scheduling method based on day-ahead robust optimization and intraday MPC rolling optimization for microgrid[J]. IEEE Access, 2021, 9: 140315-140324.Fan L, Zhang J, He Y, Liu Y, Hu T, Zhang H. Optimal Scheduling of Microgrid Based on Deep Deterministic Policy Gradient and Transfer Learning. Energies. 2021; 14(3):584. https://doi.org/10.3390/en14030584Aiping Pang，Fan Chao，Hongbo Zhou，Jing Zhang. The Method of Data Collection Based on Multiple Mobile Nodes for Wireless Sensor Network[J]. IEEE Access, 2020, Vol. 8: 14704-14713.Nian Wang, Jing Zhang, Yu He, Min Liu, Ying Zhang, Chaokuan Chen, Yerui Gu, Yongheng Ren. Load-Frequency Control of Multi-Area Power System Based on the Improved Weighted Fruit Fly Optimization Algorithm. Energies 2020, 13(2): 437.赵忠斌,张靖,马蕊,王乐,何宇.互联直流微电网多模式协调控制策略[J].智慧电力,2020,48(04):28-35Jing Zhang, Luqin Fan, Ying Zhang, Gang Yao, Peijia Yu, Guojiang Xiong, Ke Meng, Xiangping Chen, Zhaoyang Dong. A Probabilistic Assessment Method for Voltage Stability Considering Large Scale Correlated Stochastic Variables[J]. IEEE Access, 2020, Vol. 8: 5407-5415.王念,张靖,李博文,何宇,王乐.基于加权果蝇优化算法的多区域频率协同控制[J].电力系统保护与控制,2020,48(11):102-109.Xiangping Chen, Wenping Cao, Qilong Zhang, Shubo Hu, Jing Zhang: Artificial Intelligence-Aided Model Predictive Control for a Grid-Tied Wind-Hydrogen-Fuel Cell System. IEEE Access, 2020, Vol. 8 : 92418-92430 Kewen Wei,Jing Zhang,Yu He,Gang Yao,Yikun Zhang. Faulty Feeder Detection Method Based on VMD-FFT and Pearson Correlation Coefficient of Non-Power Frequency Component in Resonant Grounded Systems, Energies, 2020, vol. 13(18), pages 1-18.Yikun Zhang，Jing Zhang，Gang Yao，Xiao Xu，Kewen Wei. Zhang Y , Zhang J , Yao G , et al. Method for Clustering Daily Load Curve Based on SVD-KICIC. Energies, 2020, 13(17):4476.Pang A, Meng S, He Z, Zhang J. Robust H-Inf Phase Control for Flexible System With Weak Damping[J]. IEEE Access, 2020, 8: 195733-195740.Z. Tan, J. Zhang, Y. He, et al. Short-term load forecasting based on integration of SVR and stacking[J]. IEEE Access, 2020, 8: 227719-227728.Ying Zhang, Dangdang Dai, Jing Zhang, Xiaoli Liu, Xuxuan Chen. A Novel High Voltage Dielectric Test System Based on Resonant Circuits Using the Magnetically Controllable Inductance [J]. ADVANCES IN ELECTRICAL AND COMPUTER ENGINEERING, 2019, 19(4): 29-36.Zhang Y, Dai D, Zhang J, et al. A Novel Test Method for Real-time Magnetic Flux Measurement of Power Transformers[J]. Advances in Electrical and Computer Engineering, 2019, 19(4): 29-36.杨轶涵,张靖,何宇,张友骞,王杰.电力系统概率小扰动稳定性研究进展[J].电测与仪表,2019,56(18):57-65.张友骞,张靖,何宇,杨轶涵,王杰.含风电场的概率可用输电能力研究综述[J/OL].电测与仪表:1-12[2019-11-25]王念,张靖,李博文,顾业锐,何宇.自动发电控制研究综述[J/OL].电测与仪表:1-9[2019-11-25]Zhongbin Zhao，Jing Zhang，Yu He，Ying Zhang. Island DC Microgrid Hierarchical Coordinated Multi-Mode Control Strategy[J]. Energies, 2019, 12(15): 3012.熊国江，张靖，何宇．电力系统经济调度的正余弦优化算法仿真研究．实验室研究与探索．2019, 38(4): 76-79, 89. Jing Zhang, Guojiang Xiong, Ke Meng, Peijia Yu, Gang Yao, Zhaoyang Dong. An improved probabilistic load flow simulation method considering correlated stochastic variables[J]. International Journal of Electrical Power & Energy Systems, 2019, 111: 260-268.石帮松，张靖，李博文，何宇. 多类型售电公司共存下竞价售电的市场均衡研究[J]. 电力系统保护与控制. 2018, 46(5): 62~67. Guojiang Xiong, Jing Zhang, Dongyuan Shi, Yu He. Parameter extraction of solar photovoltaic models using an improved whale optimization algorithm. Energy Conversion and Management, 2018, 157: 424-435.Guojiang Xiong, Jing Zhang, Dongyuan Shi, Yu He. Parameter identification of solid oxide fuel cells with ranking teaching-learning based algorithm. Energy Conversion and Management, 2018, 174: 126-137.Guojiang Xiong, Dongyuan Shi, Jing Zhang, Yao Zhang. A binary coded brain storm optimization for fault section diagnosis of power systems. Electric Power Systems Research, 2018, 163: 441-451. 王扬;张靖;何宇;陈澎;李博文. 虚拟同步发电机暂态稳定协同控制. 电力自动化设备. 2018, 12: 181-185.石帮松, 张靖, 何宇, 丁娜, 渠智毅. 基于动态博弈的配电网单相电力用户用电行为分析. 电力系统自动化, 2017, 41(14) : 87-91. 张靖, 李博文, 余珮嘉, 石邦松, 何宇. 基于状态空间的双馈风力发电机模型预测控制研究. 电网技术. 2017, 41(9): 2904-2909. Bowen LI, Jing Zhang, Yu He, Yang Wang. Short-Term Load-Forecasting Method Based on Wavelet Decomposition with Second-Order Gray Neural Network Model Combined with ADF Test. IEEE Access. 2017, Vol. 5, pp. 16324-16331. 彭志炜, 张靖. 电力系统电压失稳过程的几何描述. 电力科学与技术学报. 2014，29(1): 8-12. 王超，张靖，何宇，杨艳，陈达. 基于灵敏度阻抗矩阵修正法的分层前推回代潮流算法. 北京交通大学学报, 2014,38(5):108-113.Peijia Yu, Jing Zhang. An algorithmic method to extend TOPSIS for multiple attribute decision making under intuitionistic fuzzy setting. Journal of Intelligent and Fuzzy Systems, 2014, 26(5) :2315-2333.范强, 彭志炜, 张靖. 功角稳定与电压稳定的关联性研究现状与展望. 电力系统保护与控制, 2012, 40(12): 41-48, 55. 张靖, 程时杰, 文劲宇, 彭志炜. 应用正规形理论分析发电机对电力系统电压稳定性的影响. 高电压技术, 2009, 35(12): 3149-3153. 张靖, 文劲宇, 程时杰, 彭志炜. 基于向量场正规形方法的静态电压稳定性分析. 电网技术. 2008, 32(5): 22-25.张靖, 文劲宇, 程时杰, 彭志炜. 采用正规形方法确定重要负荷节点排序. 高电压技术. 2008, 34(4):744-747.张靖, 文劲宇, 程时杰, 彭志炜. 微分同胚正规形理论在确定负荷控制地点及SVC安装地点中的应用. 电网技术. 2008, 32(15): 10-15.张靖, 文劲宇, 程时杰, 彭志炜. 应用正规形理论分析电力系统奇异摄动模型. 华东电力. 2008, 36(3): 17-21.张靖, 文劲宇, 程时杰, 彭志炜. 应用微分同胚正规形提高静态电压稳定. 高电压技术. 2008, 34(7):  1478-1482. 张靖, 文劲宇, 程时杰, 彭志炜. 用正规形方法研究负荷节点对电压稳定性的影响. 华东电力. 2008, 36(4): 27-30. Jing Zhang, J. Y. Wen, S. J. Cheng, Z.Y. Dong. Realization of the WAMS Based Power System Aggregate Load Area Model. Proceedings of IEEE PES General Meeting, July, 2008.Jing Zhang, J. Y. Wen, S. J. Cheng, et al. A Novel SVC Allocation Method for Power System Voltage Stability Enhancement by Normal Forms of Diffeomorphism. IEEE Trans. on Power System. 2007, 22(4): 1819-1825. 张靖, 文劲宇, 程时杰, 彭志炜. 通过选择SVC安装地点提高静态电压稳定性的新方法. 中国电机工程学报. 2007, 27(34): 7-11.张靖, 杨慧敏, 李悝等. 基于广域测量系统的电力系统综合区域负荷模型. 电力系统自动化. 2007, 31(20): 17-21.张靖, 文劲宇, 程时杰. 电力系统电压稳定性的平衡点分析方法.电网技术. 2006, 30(12):13-17.张靖，文劲宇，程时杰. 基于向量场正规形方法的功角和电压稳定特征分析. 电力系统自动化. 2006, 30(12): 12-16.张靖, 文劲宇, 程时杰. 基于向量场正规形的电力系统稳定模式相关性理论分析. 中国电机工程学报. 2006, 26(11): 82-86. 张靖, 文劲宇, 程时杰. 基于向量场正规形的电力系统动态分析. 中国电机工程学报. 2006, 26(16): 1-5.张靖, 文劲宇, 程时杰. 计及网络特性的电力系统非线性模式相关性分析. 中国电机工程学报. 2006, 26(25): 1-5.课题组动态：齐岳获得“做出突出贡献的工程硕士学位获得者”称号李博文获得“贵州省优秀毕业生”称号徐涛获得“贵州省优秀共产党员”称号获批建设“贵州省高等学校新型电力系统及其数字化技术工程研究中心”课题组博士、硕士研究生培养：2010级蒋婷婷（云南电科院）2011级徐涛（六盘水市阿戛镇人民政府）、张东方（徐州供电局）2012级王超（淄博供电公司）2013级杨艳（贵阳供电局）、陈达（IDALL Company, São Paulo, Brazil）2014级石帮松（贵州茅台酒厂（集团）习酒有限责任公司）、渠智毅（贵州电科院）、丁娜（贵州电力设计研究院）2015级李博文（贵州电科院）、郭杰婷（淄博供电公司）、高源（南京供电局）、罗棣（贵州电力调度控制中心）、王扬（贵州电科院）、陈澎（湖南省建筑设计研究院有限公司）2016级张友骞（贵州电网有限责任公司电力调度控制中心）、杨轶涵（国网浙江省电力有限公司经济技术研究院）、赵靓玮（中国能源建设集团湖南省电力设计院有限公司）、施雅（中冶南方工程技术有限公司）、张浩（驻成都地区航空军代室）、王杰（贵州电网有限责任公司电网规划研究中心）、唐赛秋（贵州电网有限责任公司电力科学研究院）2017级梁龙基（空军勤务学院）、陈朝宽（贵州电网有限责任公司安顺供电局）、任永恒（中国电建集团贵阳勘测设计研究院）、赵忠斌（国网山东省电力公司德州供电公司）、曾希皙（国网江西省电力有限公司赣州供电分公司）、马蕊（贵州电网有限责任公司电网规划研究中心）、王念(贵州电网有限责任公司贵阳供电局)、 王乐（贵州电网有限责任公司贵阳供电局）、顾业锐（贵州电网有限责任公司电力调度控制中心）、方裕（中国广核新能源控股有限公司华南分公司）2018级范璐钦（贵州大学）、张义坤（西安交通大学电气工程学院在读）、贺毅（中国能建湖南院）、秦典（贵州电网遵义供电局）、石国宜（贵州电网安顺供电局）、魏科文（贵州电网安顺供电局）、张恒（贵州电网兴义供电局）、何青（国网重庆綦江供电公司）、谭真奇（国网重庆长寿供电公司）、李兴莘（国网广元供电公司）、晏开封（国网毫州供电公司）2019级申有吉（贵州电网有限责任公司遵义供电局），龙本锦（贵州电网有限责任公司凯里供电局），胡攀（贵州电网有限责任公司毕节供电局），郭永强(贵州电网有限公司安顺供电局)，杜纤(贵州电网有限公司安顺供电局)，孔德政（国网浙江省电力有限公司营销服务中心），黄世超（国网重庆市电力公司綦江供电分公司）邓坤（国网四川电力公司巴中供电公司），闫江峰（贵州电网公司贵阳金阳供电局）2020级范俊秋（在读），何银(在读)，聂祥论(在读)，罗文健(在读)，蒋慕凝(在读)，阚超(在读)，邵文锋(在读)，王旭(在读)，耿冠晨(在读)，李佳(在读)，何明君(在读)，张棠茜(在读)，袁梦薇(在读)，蔡权(在读)2021级张昕（在读）、曹国强(在读) 、 孙启宸（在读）、王志杨（在读）、黎舜瑀（在读）、杨志（在读）、胡祥谢(在读)、张子见（在读）、雷爽（在读）2022级范璐钦（在读）、肖龙（在读）、谢国帅（在读）、龙传煜（在读）、敖炫（在读）、张延（在读）、樊帅志（在读）、耿显显（在读）、杨胜孙（在读）、张德木（在读)、罗鑫（在读）、杨兆瑞（在读）、沈涛（在读）、吴谋（在读）联系方式：联系地址：贵州省贵阳市花溪区贵州大学西校区电气工程学院Email：zhangjing@gzu.edu.cn",http://ee.gzu.edu.cn/2017/0918/c3595a23870/page.htm,电器工程及其自动化
刘敏,教授,,http://ee.gzu.edu.cn/2017/0918/c3595a23869/page.htm,电器工程及其自动化
