姓名,title,信息,url,dept
王霄,副教授,"王霄：           ‍‍男，1985年生，博士，副教授，硕士生导师。   2014年1月博士毕业于北京航空航天大学仪器光电学院，后任职于贵州大学电气工程学院，承担自动化本科专业的《分布式控制技术》、《过程控制》、《DSP原理及应用》、《嵌入式系统》和研究生的《信息融合理论与应用》等课程的教学任务。王霄的主要研究方向为：自组网信息融合、移动自组织网络可信计算、电子网络对抗技术、控制理论等。在攻读博士学位期间，主持工信部高校博士学科点创新基金项目1项；参与并完成了国家自然科学基金1项、国家863计划课题1项、北京市自然科学基金1项，在《EURASIP Journal on Wireless Communications and Networking》、《International Journal of Distributed Sensor Networks》、《Security Communication Networks》、《Journal of Computational Information Science》、《北京航空航天大学学报》和《高技术通讯》等国内外期刊和国际学术会议上发表SCI、EI论文10余篇，获软件著作权1项。‍研究方向：自组网信息融合与可信计算、控制理论与控制工程、物联网协议与计算、网络信息安全联系方式：贵州省贵阳市花溪区贵州大学西区电气工程学院电工楼510室邮编：550025Email：xwang9@gzu.edu.cn‍教育经历（从大学本科开始，按时间倒排序）： 2008/09-2013/12，北京航空航天大学，仪器科学与光电工程学院，工学博士 2004/09-2008/06，北京邮电大学，自动化学院，工学学士工作经历（科研与学术工作经历，按时间倒排序）： 2013/12 至今，贵州大学，电气工程学院、副教授教学与科研情况：1、主持国家自然科学基金1项、主持贵州省科技厅-贵大联合基金项目1项、主持贵州大学人才引进基金1项；参与贵州大学省级教学工程项目1项（排名第3）、参与软件产业基地公共服务平台及孵化能力建设项目1项（排名第6）、参与贵州省智能电网远程信息监测与智能信息处理科技创新人才团队项目1项（排名第3）；参与并完成贵州省科技厅农业攻关项目1项（排名第2）。2、承担本科及研究生主干课程9门，年均教学工作量达192课时。3、指导贵州大学大学生创新训练计划项目2项，其中国家级创新训练项目1项。获奖情况： 1、贵州大学电气工程学院2015-2016年度优秀共产党员；代表性研究成果：序号论文名称期刊名称；年、卷、期、页码检索号或ISSN期刊级别1机会移动Ad Hoc网络中一种自适应链路侦测数据收集算法北京航空航天大学学报；2012年，第38卷，第8期，1051-1055页EI：20124315608631EI2A Secure Model   Base on Game Theoretic Malicious Detection Mechanism for MANETsJournal of   Information and Computational Science. 2014, 11(2): 481-491EI： 20141017419875EI3A   self-adaption link-quality detection algorithm for data collecting in OSN.   Proceedings2010 IEEE   Asia-Pacific Services Computing Conference, APSCC 2010, p 516-522, 2010EI：201111137402174A Game   Theoretic Malicious Nodes Detection Model in MANETsIn: Proc. of   the 9th IEEE International Conference on Mobile Ad hoc and Sensor Systems   (IEEE MASS 2012), Volume: Supplement, Las Vegas, Nevada, USA, Oct. 2012ISSN :2155-6806ISTP5一种移动Ad Hoc网络中基于博弈协作理论的恶意节点检测模型中国科技论文在线, 2013，http://www.paper.edu.cn/releasepaper/content/201301-950ISSN：1673-7180中文核心6The   energy-efficient group key management protocol for strategic mobile scenario   of MANETsEURASIP   Journal on Wireless Communications and NetworkingIDS Number: AY2EYSCI7An   evolutionary game-based trust cooperative stimulation model for large scale   MANETsInternational   journal of distributed sensor networks, Volume 2013, Article ID 245017, 16   pagesIDS Number: 169VPSCI",http://ee.gzu.edu.cn/2017/0914/c3597a23764/page.htm,自动化系
徐凌桦,副教授,徐凌桦，男，副教授，硕士生导师，九三社员，原就职于贵州工业大学电气工程学院自动化专业，贵州工业大学与贵州大学合并后，进入贵州大学电气工程学院自动化专业任教至今。    长期从事自动化专业的本科和硕士的教学及科研工作，主持和参与多项省级纵向课题和横向课题，2019年获得贵州省科技进步奖三等奖。    目前主要研究领域为：嵌入式系统、传感器网络、工业自动化及智能控制。    联系方式：xubutou@qq.com,http://ee.gzu.edu.cn/2017/0914/c3597a23769/page.htm,自动化系
罗雪梅,副教授,罗雪梅：   女，1977年生，副教授，硕士生导师，研究生。主要从事现场总线技术及其应用、网络技术在控制系统中的应用的科研与教学工作。 科研教改项目及论文情况：  科研项目（主持省级项目1项，参与国家级、省部级项目4项），下面是主持的部分项目情况  1．CAN_LIN混合网络组网技术在汽车车窗系统中的应用研究，贵州省自然科学基金  教改项目（主持校级教改项目2项，指导省级大学生创新项目1项） 论文： 近年来以第一作者身份在国内核心期刊上发表学术论文、教改论文近10篇。,http://ee.gzu.edu.cn/2017/0914/c3597a23768/page.htm,自动化系
马家庆,副教授,"马家庆，男，贵州大学电气工程学院讲师。1981年11月生，贵州余庆松烟人。西南交通大学电气工程学院工学博士学位，中国电源学会高级会员，IEEE T IND ELECTRON审稿人。目前研究方向为交流电机矢量控制及电力电子器件能量传递效率、新能源并网及电力大数据、高温超导磁悬浮。联系方式：贵州省贵阳市花溪区贵州大学西校区东区电气工程学院电工楼514室 邮编：550025。个人电话：13880615382。Email: 357287962@qq.com;  jqma@gzu.edu.cn;  教育经历2.2008/9–2014/12，西南交通大学，电工理论与新技术，工学博士学位1.2004/9–2008/7，四川师范大学，电子信息工程，工学学士学位 科研与学术工作经历：2.2017/7-，     贵州大学，电气工程学院，讲师1.2015/1-2017/6，西南交通大学，机械工程学院，博士后 主持或参加科研项目（课题）及人才计划项目情况： 5. 贵州省科技厅-贵大联合基金,双馈电机非线性控制方法及其运行稳定性研究,黔科合LH字[2017]7229号,2017/11/20-2020/12/01，7万元，在研，主持。4. 贵州大学人才引进基金,基于滑模变结构控制的永磁同步电机能量传递效率研究,贵大人基合字(2016)08号，2017/01/01-2019/12/31，3.5万元，在研，主持。3. 西南交通大学博士后科研基金,2015/01-2016/05，1万元，结题，主持。2. 西南交通大学博士创新基金,2012/09-2014/08，3万元，结题，主持。1. 国家自然科学基金,51377138,2014/01-2017/12，88万元，在研，参与，等 第一作者论文[10]马家庆,崔宸昱,周大进,赵立峰,张勇,赵勇.HTS磁浮系统中永磁轨接头处的运行阻力简化分析方法. 低温物理学报，2017，39(6)：39-44 （CSCD）[9] 马家庆,崔宸昱,周大进,赵立峰,张勇,赵勇.基于振动耗能的真空管道HTS磁浮列车能量回收方法研究. 低温物理学报，2017，39(2)：38-42 （CSCD）[8] 马家庆,周大进,赵立峰,梁纲，张勇,赵勇. 真空管道HTS磁浮系统中振动耗能法电磁制动分析.真空科学与技术学报,2015,35(2):130-136 （EI收录：20151700789767）[7] 马家庆,周大进,赵立峰,张勇,赵勇.初级级联直线感应电机无速度传感器矢量控制.西南交通大学学报，2015,50(3):417-422（EI收录：20152801031624）[6] 马家庆,周大进,赵立峰,张勇,赵勇.高温超导磁浮系统中直线电机的电流瞬时值法气隙磁场分析.低温物理学报，2014，36(1)：55-59 （CSCD）[5] 马家庆,周大进,赵立峰,张勇,赵勇.真空管道中高温超导磁悬浮车运行时的振动能耗特性.真空科学与技术学报,2014,34(2)：119-125（EI收录：20141217482078）[4] 马家庆,周大进,赵立峰,梁纲，张勇,赵勇. HTS磁浮系统中直线驱动电机的电流瞬时值法推力分析.低温物理学报,2015，37(1):46-53（CSCD）[3] 马家庆,周大进,赵立峰,张勇,赵勇.高温超导磁浮系统中驱动器电源的母线稳压控制器设计. 低温物理学报，2014，36(4)：288-293（CSCD）[2] Jiaqing Ma,Dajing Zhou,Lifeng Zhao,Yong Zhang,Yong Zhao.The approach to calculate the aerodynamic drag of maglev train in the evacuated tube.Journey of Modern Transportation,2013,21(3):200-208[1] Jiaqing MA,Yunpeng ZHU,Jing JIANG.A novel method to calculate the thrust of linear induction motor based on instantaneous current value.Journal of Modern Transportation,2012,20(2):76-81非第一作者论文[7] 周大进,崔宸昱,马家庆,赵立峰,张勇,赵勇. 真空管道HTS侧浮系统中线性电机起动特性研究[J]. 西南交通大学学报,2016,(04):750-758. （EI收录）[6] 周大进,马家庆,赵立峰,杨金磊，张勇，赵勇.HTS磁浮系统中长初级直线电机三相绕组特性分析. 2015,37(1):54-59[5] 周大进,马家庆,赵立峰,张勇，郭健强，赵勇.真空管道HTS磁浮列车实验系统环形加速器设计，真空科学与技术学报,2015,35(4):391-398（EI收录：20152200901069）[4] 周大进,马家庆,王小峰,李平原, 赵立峰,张勇.基于TC35i的无线信息采集传输终端设计.信息技术，2013,1:31-35[3]Dajing Zhou, Jiaqing Ma,Lifeng Zhao,Xiao Wan,Yong Zhang, Yong Zhao.The time and space characteristics of magnetomotive force in the cascaded linear induction motor.Journey of Modern Transport,2013,21(3):194-199[2] 罗江虎, 马家庆,高鹏, 赵勇.基于PWM整流器双闭环控制的超导电磁储能功率调节器的研究.低温物理学报,2012,04(34):241-245[1] Xuyong CHEN, Lifeng ZhAO,Jiaqing MA,Yuansen LIU.Aerodynamic simulation of evacuated tube maglev trains with different streamlined designs.Journal of Modern Transportation,2012,20(2):115-120",http://ee.gzu.edu.cn/2017/0914/c3597a23753/page.htm,自动化系
曹敏,副教授,女，贵州大学 电气工程学院 自动化专业教师。    长期从事自动化专业的本科和硕士的教学及科研工作，目前主要研究领域为：控制理论及控制工程。,http://ee.gzu.edu.cn/2017/0914/c3597a23766/page.htm,自动化系
杨明,特聘教授,,http://ee.gzu.edu.cn/2021/0806/c3597a156418/page.htm,自动化系
庞爱平,特聘教授,"个人简介：硕士生导师/ 贵州大学学科学术带头人培养对象/一流学科特岗教授；九三学社贵州省科技与资环委专委会委员/中国指挥与控制学会空天安全学会常务委员；主持国家自然科学基金1项，省部级以上基础研究和人才项目3项，以及各类横向项目共10余项；以第一作者/通讯作者发表论文30余篇，其中，SCI论文20余篇，中科院二区以上10余篇。联系方式：417524788@qq.com; appang@gzu.edu.cn;工作经历：2020/12-至今，贵州大学，一流学科特聘教授；2021/09-2022/07，清华大学，自动化系，访问学者；2021/12-至今，贵州大学，自动化系，副教授；2018/09-2020/12，贵州大学，自动化系，讲师；2014/03-2018/01，哈尔滨工业大学，航天学院自动化系，博士；2011/09-2013/07，哈尔滨工业大学，理学院数学系，硕士 ；2005/09-2009/07，哈尔滨师范大学，数学与计算机科学学院，学士；研究方向：1.航天器控制与空间惯性技术；2.工业大数据与物联网；3.新能源与智能电网。教育教学：主讲自动控制原理、现代控制原理、智能控制等自动化相关专业课程；获得贵州大学首届青教赛三等奖。培养控制理论与控制工程/模式识别与智能系统学硕，控制工程专硕。科研项目：15.国家地区科学基金，考虑微推进系统干扰特性和输出约束的卫星自抗扰无拖曳控制，12162007，2022/01-2025/12，主持，在研；14.航天等离子体推进工信部重点实验室，面向空间引力波探测的微推进无拖曳控制研究2021/10-2023/10，在研，主持；13.贵州大学研究生院，学科交叉融合的电气工程创新人才计划，YKJP202310，2023/05-2025/05，在研，参与；12. 贵大勘察设计研究院，贵大勘察[2022] 02号，高比例新能源发电预测随机场景生成方法研究，2022/12- 2025/12，在研，参与；11. 贵州省科技厅，科学技术基金，黔科合基础-ZK[2022]一般062，面向可再生能源场景生成的深度学习模型及算法性能研究，2022/04-2025/03，在研，参与10. 贵州省科技厅，优秀青年科技人才项目，黔科合平台人才[2021]5645号，智能电网的柔性运行和优化控制技术，2021/12-2024/12，在研，参与；9.贵州大学科研院，贵大培育[2019]60，大型柔性航天器的结构化综合控制，2020/10-2023/10，主持，已结题；  8.贵州省教育厅，青年人才项目，黔科合KY[2021]100,挠性系统的鲁棒综合控制研究，2021/1-2023/1，主持，已结题；7. 天琴计划教育部重点实验室，面向引力波探测的卫星自抗扰高增益无拖曳控制，2020/10-2022/10，主持，已结题；  6.贵州省科技厅，科学技术基金，黔科合基础[2020]1Y273，H∞控制的结构化方法与应用研究，2020/01-2022/12，主持，已结题;5.大连理工大学合作研究项目，大型柔性系统的自适应控制研究，2019/11-2020/09，主持，已结题;4.贵州大学人才引进项目，[2018]1，运动物体的H∞综合控制制研究，2019/01-2021/01，主持，已结题;3.国家自然科学地区科学基金，6196020572，基于非充分故障信息的渐进主动容错控制方法研究，2020/01-2023/12，参与，在研;2.贵州省科技厅，科学技术基金，黔科合基础[2020]1Y266，面向山地场景的异构传感器网络拓扑生成与路由算法研究，2020/01-2022/12，参与，已结题;1.贵州省科技厅工业攻关项目，大规模太阳能光伏阵列运维关键技术研究，黔科合支撑[2019]2152号，2019/01-2022/12，参与，已结题;第一作者/通讯作者论文：[34]周俊杰，庞爱平*，周鸿博，孟范伟，刘辉.考虑微推力器输出特性的引力波探测卫星分数阶PID控制[J/OL].深空探测:2023. （北大核心）[33] Zhou J, Pang A*, Zhou H. Active Disturbance Rejection Control of drag-free satellites considering the effect of micro-propulsion noise[J]. iScience. （SCI /中科院二区）[32] H. Feng, HB.Zhou, CM Jiang*, A. Pang*. Active Disturbance Rejection Control of drag-free satellites considering the effect of micro-propulsion noise[J]. Plosone.2023（SCI/ JCR Q1 /中科院三区）[31] Shengcheng Wu; Aiping Pang *. Optimal scheduling strategy for orderly charging and discharging of electric vehicles based on spatio-temporal characteristics . Journal of Cleaner Production [J]. 392 (2023) 136318. （SCI /JCR Q1/中科院一区）[30] Zhou, J; Pang, A*; Liu, H;Zhou, H; Niu, X. Precision Feedback Control Design of Miniature Microwave Discharge Ion Thruster for Space GravitationalWave Detection. Aerospace[J]. 2022, 9, 760. https://doi.org/10.3390/aerospace9120760（SCI/ JCR Q1/中科院三区）[29]. Xinhan Li , Wen Yang , Aiping Pang ∗, Congmei Jiang , Qianchuan Zhao ,Syed Naeem Haider. A fault diagnosis method for VRLA battery in data center, Energy Reports [J]. 2022.14220–14235. （SCI/JCR Q1/中科院二区）[28]周俊杰,庞爱平*,刘辉,周鸿博,牛翔.基于微波调控的离子推力器数字反馈控制研究[J/OL].推进技术:1-13[2022-11-08].DOI:10.13675/j.cnki.tjjs.2209073. （EI期刊）[27] H. Feng, A. Pang*,HB.Zhou. High precision robust control design of piezoelectric nanopositioning platform, Scientific Reports[J]. 2022, 4(7).（SCI/中科院三区）[26] 冯焕,庞爱平*. 大型柔性航天器的高精度结构化综合控制[J]. 科学技术与工程, 2022,（北大核心）[25] 朱辉,杨文,庞爱平*.基于OpenModelica仿真平台的暖通空调系统故障诊断研究[J]. 智能计算机与应用, 2021, 11(7):6. （中文核心）[24] H. Zhu, W. Yang and A. Pang*, ""HVAC System Modeling and Fault Simulation Research Based on Modelica,"" 2021 China Automation Congress (CAC), 2021, pp. 79-84, doi: 10.1109/CAC53003.2021.9727539.（EI 会议）[23] Hui Zhu,Wen Yang, Shihong Li，Aiping Pang*. An Effective Fault Detection Method for HVAC Systems Using the LSTM-SVDD Algorithm [J]. Buildings 2022, 12, 246.（SCI/中科院三区）[22] Yuntian Zhang, Aiping Pang*, Hui Zhu, Huan Feng. Structured H∞ Control for Spacecraft with Flexible Appendages. Entropy. 2021; 23(8):930（SCI /JCR Q1/中科院三区）[21] Aiping Pang，Hongbo Zhou, Wenjie Cai ,JingZhang*. Improved Adaptive Augmentation Control for a Flexible Launch Vehicle with Elastic Vibration. Entropy 2021, 23, 1058. （SCI /JCR Q1/中科院三区）[20]Aiping Pang, Hui Zhu,Junjie Zhou, Jing Yang*. Robust H∞ Control for The Spacecraft with Flexible Appendages[J]. Complexity.2020. （SCI 收录/JCR Q1//中科院二区）[19] Aiping Pang, Hui Zhu,Hongbo Zhou, Tao Qin, Jing Yang*, Daoyin Long. Fixed-order H∞ control of an electric power steering system[J]. Modelling, Identification and Control, 2021 Vol. 37, Nos. 3/4, pp.258–266. （EI收录）[18] Aiping Pang, Shengya Meng, Zhen He, Jing Zhang*. Robust H-inf phase control for flexible system with Weak damping [J].IEEE Acess.2020. vol. 8, pp. 195733-195740, 2020, doi: 10.1109/ACCESS.2020.3034222.（SCI /JCR Q1/中科院二区）[17] Fanwei Meng, Kai Liu , Aiping Pang*. Fractional Order PID parameter tuning for Solar collector system based on Frequency domain analysis [J].IEEE Acess.2020. v 9. （SCI /JCR Q1/中科院二区）[16] Hongbo Zhou , Aiping Pang*, Jing Yang. Structured H∞ Control of an Electric Power Steering System [J].Complexity.Learning and Adaptation for Optimization and Control of Complex Renewable Energy Systems (LAOCC).Article ID 9371327, 7 pages, 2020.（SCI /JCR Q1/中科院二区）[15 Aiping Pang, Fan Chao, Hongbo Zhou, and Jing Zhang* .The method of Data Collection based on Multiple Mobile Nodes for Wireless Sensor Network [J]. IEEE Acess.2020. v 8, p 14704-14713（SCI/JCR Q1//中科院二区）[14]Fan CHAO, Zhiqin He, Aiping Pang*, Hongbo Zhou, and Junjie Ge.Path Optimization of Mobile Sink Node in Wireless Sensor Network Water Monitoring System[J]. Complexity.2019. （SCI//JCR Q1/中科院二区）[13]Aiping Pang*, Zhen He*, Ming-han Zhao, Guang-xiong Wang, Qin-mu Wu, and Ze-tao Li. Sum of Squares Approach for Nonlinear H-infinity Control [J]. Complexity, vol. 2018, Article ID 8325609, 7 pages, 2018. (SCI /JCR Q1/中科院二区)[12]Fanwei Meng, Aiping Pang*, Xuefei Dong, Chang Han, Xiaopeng Sha. H∞ Optimal Performance Design of an Unstable Plant under Bode Integral Constraint [J]. Complexity, Bio-Inspired Learning and Adaptation for Optimization and Control of Complex Systems (BLAOCA), 2018, (SCI /JCR Q1/中科院二区)[11]Aiping Pang, Zhen HE, Minglei LIU, Jing YANG*. Planning avoidance H-inf design for supercavitating vehcicles[J]. International Journal of Modelling, Identification and Control.（EI收录）[10]庞爱平，周鸿博，杨靖*. 大型飞机的结构化H-inf控制设计[J].电机与控制学报. 2020（10）（EI收录）[9]庞爱平，何朕. 超空泡航行体观测器补偿设计[J].电机与控制学报. 2018,22(1):1-7.（EI收录）[8]何朕，庞爱平*. 水下超空泡航行体反馈控制设计[J].电机与控制学报.2017,21(8):101-108.（EI收录）[7]庞爱平，何朕，王京华，王广雄. 水下高速超空泡航行体H-inf状态反馈控制[J].控制理论与应用.2018,34(2):10-17. （EI收录）[6]何朕，庞爱平*，王京华. 水下高速超空泡航行体建模与分析[J].2018,30(8)：3092-3098系统与仿真学报.（核心期刊）[5]庞爱平，何朕，超凡，杨靖，王广雄. 超空泡航行体时滞特性分析[J].控制工程.（核心期刊）[4]Aiping Pang，Zhen He， Min-han Zhao， Jinghua Wang, Feng Guo， Mingyun Chen. control of longitudinal motion for under water high speed supercavitating vehicles[C]. International Conference on Modelling, Identification and Control, Guiyang,2018.（EI收录）[3]Aiping Pang, Zhen He*. Double-loop Decoupling Control For a Supercavitating Vehicle[C]. Youth academic annual conference, Hefei, 2017.（EI收录）[2]Jinghua Wang, Aiping Pang*, Yang Liu, Xinlin CHEN, Kaiping YU. Control Design for a Time-delay Supercavitating Vehicle Model[C]. Intermational Conference Mechanical Engineering and Control Automation, Wuhan, 2016.1.224-229.[1] Liu Minglei, Zhou Hongbo Pang Aiping*. Research on motion control system of 6-DOF robotic arm[C]. International Conference on Modelling, Identification and Control, Tianjin, 2019. （EI收录）[0]Liu Ming-lei, Pang Ai-xin, Pang Ai-ping*, Liu Xiao-yan, Wu Qin-mu, Li Ze-tao. 2018. Delay-range-dependent robust H∞ control method for a linear parameter varying uncertain system with actuator saturation and state delay[J].International Journal of Applied Mathematics in Control Engineering.",http://ee.gzu.edu.cn/2019/0915/c3597a121231/page.htm,自动化系
王德光,特聘教授,"王德光网站介绍信息王德光，1991年6月生，男，汉族，山西侯马人。2019年于西安电子科技大学控制科学与工程专业获博士学位，现为贵州大学电气工程学院自动化系教师，从事教学与科研工作。联系方式：贵州省贵阳市花溪区贵州大学西校区东区电气工程学院电工楼502室，邮编：550025，Email: wdeguang1991@163.com。主要研究方向：理论研究：监督控制理论，离散事件系统故障诊断，复杂系统建模与分析应用研究：机器人路径规划、调度教育经历：2014/09–2019/12，西安电子科技大学，控制理论与控制工程专业，博士2009/09–2011/06，西安电子科技大学，自动化专业，学士2018/10–2019/04，瑞典皇家理工学院，机电系，访问博士生2016/12–2017/11，加拿大多伦多大学，电气计算机工程系，访问博士生工作经历：2020/09-至今，贵州大学，电气工程学院，讲师（特聘教授）科研项目：贵州大学，自然科学专项（特岗）科研基金项目，贵大特岗合字（2021）04号，基于状态树结构的离散事件系统分布式故障诊断，2021-03至2024-02，25万元，在研，主持国家自然科学基金委员会，面上项目，61873342，加标Petri网的死锁分析与控制，2019-01至2022-12，66万元，在研，参加国家自然科学基金委员会，青年科学基金，61703322，基于状态树结构监督控制理论的实时系统调度与重构研究，2018-01至2020-12，26万元，已结题，参加国家自然科学基金委员会，面上项目，61672400，动态非平稳环境下的数据描述与系统建模：粒计算的框架，2017-01至2020-12，62万元，已结题，参加学术论文：Wang Deguang(王德光), Wang Xi, Li Zhiwu. Nonblocking supervisory control of state-tree structures with conditional-preemption matrices[J]. IEEE Transactions on Industrial Informatics, 2020, 16(6):3744-3756. (IF: 10.215, 中科院分区1区)Wang Deguang(王德光),Wang Xi, Li Zhiwu. State-based fault diagnosis of discrete-event systems with partially observable outputs[J]. Information Sciences, 2020, 529:87-100. (IF: 6.795，中科院分区1区)。Wang Deguang(王德光), Lin Liyong, Li Zhiwu, and Wonham W M. State-based control of discrete-event systems under partial observation[J]. IEEE Access, 2018, 6(2):42084-42093. IEEE Access (IF: 3.367，中科院分区3区)研究生招生：欢迎有志读研的同学报考本人的研究生，大家一起学习，共同进步，如果你够厉害，本人也愿意为你更改研究方向。此外，本人性格活泼开朗，待人和善，凡事为学生考虑，不会做折磨学生身心的事情。本人希望所招研究生能够吃苦耐劳，学会独立思考，能力差点没有关系，重点是态度端正。我的目标是：快乐学习，快乐科研，有所收获。",http://ee.gzu.edu.cn/2021/0806/c3597a156417/page.htm,自动化系
